{
  "kind": "enterprise-agent-model-credential",
  "bundle_id": "44444444-4444-4444-8444-444444444444",
  "credential_id": "33333333-3333-4333-8333-333333333333",
  "credential_version": 1,
  "subject": {
    "mine_id": "MINE-QY-001",
    "system_id": "agent-mine-qy-001",
    "party_id": "operator-qy-001",
    "pair_id": "11111111-1111-4111-8111-111111111111"
  },
  "provider": {
    "provider_id": "example-openai-compatible-provider",
    "protocol": "openai-compatible-chat-completions",
    "base_url": "https://api.example.invalid/v1",
    "model": "example-coal-model",
    "capabilities": [
      "chat",
      "coal-news-search",
      "extraction"
    ],
    "timeout_seconds": 20,
    "max_retries": 2
  },
  "api_key": "EXAMPLE_ONLY_NOT_A_REAL_PROVIDER_CREDENTIAL_2026"
}
